<?xml version="1.0" encoding="UTF-8"?>
<AttendanceSystem xmlns:xsi="http://www.w3.org/2001/XMLSchema-instance" xsi:noNamespaceSchemaLocation="C:\Users\T.B\Desktop\Edit Schema\attendance.xsd">
	<users>
		<students>
			<student>
				<id>7</id>
				<name>hassan</name>
				<birthDate>2002-02-12</birthDate>
				<email>mo3456@gmail.com</email>
				<password>amira2345</password>
	           <mobileNo>01023412345</mobileNo>
				<trackName>OS</trackName>
				<attendance>
					<item>
						<teacherID>48</teacherID>
						<date>2020-12-01</date>
						<state>absent</state>
					</item>
					<item>
						<teacherID>5</teacherID>
						<date>2020-12-11</date>
						<state>attendant</state>
					</item>
				</attendance>
			</student>
			<student>
				<id>20</id>
				<name>mohamed</name>
				<birthDate>2002-02-12</birthDate>
				<email>amira@gmail.com</email>
				<password>amira7yf</password>
				<mobileNo>01023412376</mobileNo>
				<trackName>OS</trackName>
				<attendance>
					<item>
						<teacherID>48</teacherID>
						<date>2020-12-01</date>
						<state>absent</state>
					</item>
					<item>
						<teacherID>5</teacherID>
						<date>2020-12-11</date>
						<state>absent</state>
					</item>
				</attendance>
			</student>
		</students>
		<teachers>
			<teacher>
				<id>5</id>
				<name>mohamed</name>
				<birthDate>2002-12-02</birthDate>
				<email>hhgg323@gmail.com</email>
				<password>mohamed234</password>
				<mobileNo>01023456376</mobileNo>
				<hiringDate>2020-12-02</hiringDate>
				<salary>4000</salary>
				<tracks>
					<trackName>PD</trackName>
					<trackName>OS</trackName>
				</tracks>
			</teacher>
			<teacher>
				<id>48</id>
				<name>mohamed</name>
				<birthDate>2002-12-02</birthDate>
				<email>teacher1@gmail.com</email>
				<password>ali874</password>
				<mobileNo>01023478376</mobileNo>
				<hiringDate>2020-12-22</hiringDate>
				<salary>4000</salary>
				<!--Or under the courses element if the track is associated with a specific course:-->
				<tracks>
					<trackName>PD</trackName>
					<trackName>OS</trackName>
				</tracks>
			</teacher>
		</teachers>
		<admins>
			<admin>
				<id>6</id>
				<name>mohamed</name>
				<birthDate>2002-12-02</birthDate>
				<email>hhgg23@gmail.com</email>
				<password>ahmed764</password>
				<mobileNo>01023411245</mobileNo>
				<startDate>2020-10-11</startDate>
				<role>assistant</role>
			</admin>
			<admin>
				<id>9</id>
				<name>mohamed</name>
				<birthDate>2002-12-02</birthDate>
				<email>admin1@gmail.com</email>
				<password>hassan432</password>
				<mobileNo>01063412376</mobileNo>
				<startDate>2020-10-11</startDate>
				<role>manager</role>
			</admin>
		</admins>
	</users>
	<tracks>
		<track>
			<trackName>OS</trackName>
			<teachers>
				<teacherID>5</teacherID>
				<teacherID>48</teacherID>
			</teachers>
		</track>
		<track>
			<trackName>PD</trackName>
			<teachers>
				<teacherID>5</teacherID>
				<teacherID>48</teacherID>
			</teachers>
		</track>
	</tracks>
</AttendanceSystem>
